<?xml version="1.0" encoding="UTF-8" standalone="no"?>
<!DOCTYPE list SYSTEM "skills.dtd">
<list>
    <skill id="9504" level="1" name="Scroll: PK (Low-grade)">
        <set name="operate_type" value="A1"/>
        <set name="icon" value="icon.skill0000"/>
        <set name="magic_level" value="1"/>
        <set name="magic_type" value="0"/>
        <set name="special_level" value="0"/>
        <set name="magic_critical_rate" value="5"/>
        <set name="change_skill_id" value="0"/>
        <set name="is_magic" value="2"/>
        <set name="is_double" value="0"/>
        <set name="item_consume" value="35741:1"/>
        <set name="cast_range" value="-1"/>
        <set name="effective_range" value="-1"/>
        <set name="skill_hit_time" value="2.0"/>
        <set name="skill_cool_time" value="0.2"/>
        <set name="skill_hit_cancel_time" value="0.5"/>
        <set name="reuse_delay" value="3.0"/>
        <set name="attribute" value="attr_none;0"/>
        <set name="trait" value="trait_none"/>
        <set name="target_type" value="self"/>
        <set name="affect_scope" value="single"/>
        <set name="affect_limit" value="0;0"/>
        <set name="next_action" value="none"/>
        <set name="debuff" value="0"/>
        <set name="ride_state" value="ride_none;ride_strider;ride_wyvern;ride_wolf"/>
        <set name="multi_class" value="0"/>
        <set name="undeletable" value="0"/>
        <set name="olympiad_use" value="1"/>
        <operate_cond>
            <cond name="op_pkcount">
                <def name="op_pkcount_param1" value="self"/>
            </cond>
            <cond name="op_territory">
                <def name="op_territory_param1" value="{{18667;169635;-3496;0};{18462;171131;-3504;0};{15907;170795;-3544;0};{16992;169099;-3504;0}}"/>
                <def name="op_territory_param2" value="t_self"/>
            </cond>
            <cond name="op_not_cursed"/>
        </operate_cond>
        <for>
            <effect name="i_pk_count">
                <def name="i_pk_count_param1" value="-1"/>
            </effect>
        </for>
    </skill>
    <skill id="9505" level="1" name="Scroll: PK (Mid-grade)">
        <set name="operate_type" value="A1"/>
        <set name="icon" value="icon.skill0000"/>
        <set name="magic_level" value="1"/>
        <set name="magic_type" value="0"/>
        <set name="special_level" value="0"/>
        <set name="magic_critical_rate" value="5"/>
        <set name="change_skill_id" value="0"/>
        <set name="is_magic" value="2"/>
        <set name="is_double" value="0"/>
        <set name="item_consume" value="35752:1"/>
        <set name="cast_range" value="-1"/>
        <set name="effective_range" value="-1"/>
        <set name="skill_hit_time" value="2.0"/>
        <set name="skill_cool_time" value="0.2"/>
        <set name="skill_hit_cancel_time" value="0.5"/>
        <set name="reuse_delay" value="3.0"/>
        <set name="attribute" value="attr_none;0"/>
        <set name="trait" value="trait_none"/>
        <set name="target_type" value="self"/>
        <set name="affect_scope" value="single"/>
        <set name="affect_limit" value="0;0"/>
        <set name="next_action" value="none"/>
        <set name="debuff" value="0"/>
        <set name="ride_state" value="ride_none;ride_strider;ride_wyvern;ride_wolf"/>
        <set name="multi_class" value="0"/>
        <set name="undeletable" value="0"/>
        <set name="olympiad_use" value="1"/>
        <operate_cond>
            <cond name="op_pkcount">
                <def name="op_pkcount_param1" value="self"/>
            </cond>
            <cond name="op_territory">
                <def name="op_territory_param1" value="{{18667;169635;-3496;0};{18462;171131;-3504;0};{15907;170795;-3544;0};{16992;169099;-3504;0}}"/>
                <def name="op_territory_param2" value="t_self"/>
            </cond>
            <cond name="op_not_cursed"/>
        </operate_cond>
        <for>
            <effect name="i_pk_count">
                <def name="i_pk_count_param1" value="-3"/>
            </effect>
        </for>
    </skill>
    <skill id="9506" level="1" name="Scroll: PK (High-grade)">
        <set name="operate_type" value="A1"/>
        <set name="icon" value="icon.skill0000"/>
        <set name="magic_level" value="1"/>
        <set name="magic_type" value="0"/>
        <set name="special_level" value="0"/>
        <set name="magic_critical_rate" value="5"/>
        <set name="change_skill_id" value="0"/>
        <set name="is_magic" value="2"/>
        <set name="is_double" value="0"/>
        <set name="item_consume" value="35753:1"/>
        <set name="cast_range" value="-1"/>
        <set name="effective_range" value="-1"/>
        <set name="skill_hit_time" value="2.0"/>
        <set name="skill_cool_time" value="0.2"/>
        <set name="skill_hit_cancel_time" value="0.5"/>
        <set name="reuse_delay" value="3.0"/>
        <set name="attribute" value="attr_none;0"/>
        <set name="trait" value="trait_none"/>
        <set name="target_type" value="self"/>
        <set name="affect_scope" value="single"/>
        <set name="affect_limit" value="0;0"/>
        <set name="next_action" value="none"/>
        <set name="debuff" value="0"/>
        <set name="ride_state" value="ride_none;ride_strider;ride_wyvern;ride_wolf"/>
        <set name="multi_class" value="0"/>
        <set name="undeletable" value="0"/>
        <set name="olympiad_use" value="1"/>
        <operate_cond>
            <cond name="op_pkcount">
                <def name="op_pkcount_param1" value="self"/>
            </cond>
            <cond name="op_territory">
                <def name="op_territory_param1" value="{{18667;169635;-3496;0};{18462;171131;-3504;0};{15907;170795;-3544;0};{16992;169099;-3504;0}}"/>
                <def name="op_territory_param2" value="t_self"/>
            </cond>
            <cond name="op_not_cursed"/>
        </operate_cond>
        <for>
            <effect name="i_pk_count">
                <def name="i_pk_count_param1" value="-5"/>
            </effect>
        </for>
    </skill>
    <skill id="9507" level="1" name="Scroll: PK (Top-grade)">
        <set name="operate_type" value="A1"/>
        <set name="icon" value="icon.skill0000"/>
        <set name="magic_level" value="1"/>
        <set name="magic_type" value="0"/>
        <set name="special_level" value="0"/>
        <set name="magic_critical_rate" value="5"/>
        <set name="change_skill_id" value="0"/>
        <set name="is_magic" value="2"/>
        <set name="is_double" value="0"/>
        <set name="item_consume" value="35754:1"/>
        <set name="cast_range" value="-1"/>
        <set name="effective_range" value="-1"/>
        <set name="skill_hit_time" value="2.0"/>
        <set name="skill_cool_time" value="0.2"/>
        <set name="skill_hit_cancel_time" value="0.5"/>
        <set name="reuse_delay" value="3.0"/>
        <set name="attribute" value="attr_none;0"/>
        <set name="trait" value="trait_none"/>
        <set name="target_type" value="self"/>
        <set name="affect_scope" value="single"/>
        <set name="affect_limit" value="0;0"/>
        <set name="next_action" value="none"/>
        <set name="debuff" value="0"/>
        <set name="ride_state" value="ride_none;ride_strider;ride_wyvern;ride_wolf"/>
        <set name="multi_class" value="0"/>
        <set name="undeletable" value="0"/>
        <set name="olympiad_use" value="1"/>
        <operate_cond>
            <cond name="op_pkcount">
                <def name="op_pkcount_param1" value="self"/>
            </cond>
            <cond name="op_territory">
                <def name="op_territory_param1" value="{{18667;169635;-3496;0};{18462;171131;-3504;0};{15907;170795;-3544;0};{16992;169099;-3504;0}}"/>
                <def name="op_territory_param2" value="t_self"/>
            </cond>
            <cond name="op_not_cursed"/>
        </operate_cond>
        <for>
            <effect name="i_pk_count">
                <def name="i_pk_count_param1" value="-10"/>
            </effect>
        </for>
    </skill>
</list>
