<?xml version="1.0" encoding="UTF-8" standalone="no"?>
<!DOCTYPE list SYSTEM "skills.dtd">
<list>
    <skill id="23174" level="1" name="Soul Stealth">
        <set name="operate_type" value="A2"/>
        <set name="icon" value="icon.skill_agathion_special"/>
        <set name="magic_level" value="-1"/>
        <set name="magic_type" value="1"/>
        <set name="special_level" value="-1"/>
        <set name="magic_critical_rate" value="-5"/>
        <set name="change_skill_id" value="0"/>
        <set name="is_magic" value="2"/>
        <set name="is_double" value="0"/>
        <set name="cast_range" value="600"/>
        <set name="effective_range" value="600"/>
        <set name="skill_hit_time" value="3.0"/>
        <set name="reuse_delay" value="43200.0"/>
        <set name="reuse_delay_lock" value="1"/>
        <set name="activate_rate" value="-1"/>
        <set name="basic_property" value="none"/>
        <set name="abnormal_time" value="1800"/>
        <set name="abnormal_lv" value="26"/>
        <set name="abnormal_type" value="resurrection_special"/>
        <set name="irreplaceable_buff" value="1"/>
        <set name="buff_protect_level" value="1"/>
        <set name="attribute" value="attr_none;0"/>
        <set name="trait" value="trait_none"/>
        <set name="effect_point" value="1"/>
        <set name="target_type" value="self"/>
        <set name="affect_scope" value="single"/>
        <set name="affect_limit" value="0;0"/>
        <set name="next_action" value="none"/>
        <set name="debuff" value="0"/>
        <set name="ride_state" value="ride_none;ride_strider;ride_wyvern;ride_wolf"/>
        <set name="multi_class" value="0"/>
        <set name="undeletable" value="0"/>
        <set name="olympiad_use" value="0"/>
        <operate_cond>
            <cond name="op_need_agathion"/>
        </operate_cond>
        <for>
            <effect name="p_resurrection_special">
                <def name="p_resurrection_special_param1" value="100"/>
                <def name="p_resurrection_special_param2" value="100"/>
                <def name="p_resurrection_special_param3" value="100"/>
                <def name="p_resurrection_special_param4" value="11786:1"/>
            </effect>
        </for>
    </skill>
</list>
