<?xml version="1.0" encoding="UTF-8" standalone="no"?>
<!DOCTYPE list SYSTEM "skills.dtd">
<list>
    <skill id="54100" level="1" name="Sayha's Shield">
        <!--TODO: Notdone-->
        <set name="operate_type" value="P"/>
        <set name="icon" value="icon.skill1040"/>
        <set name="skill_hit_time" value="0.5"/>
        <set name="reuse_delay" value="2.0"/>
        <set name="cast_range" value="-1"/>
        <set name="debuff" value="0"/>
    </skill>
    <skill id="54101" level="1" name="Sayha's Magic Barrier">
        <!--TODO: Notdone-->
        <set name="operate_type" value="P"/>
        <set name="icon" value="icon.skill1036"/>
        <set name="skill_hit_time" value="0.5"/>
        <set name="reuse_delay" value="2.0"/>
        <set name="cast_range" value="-1"/>
        <set name="debuff" value="0"/>
    </skill>
    <skill id="54103" level="1" name="Sayha's Decrease Weight">
        <!--TODO: Notdone-->
        <set name="operate_type" value="P"/>
        <set name="icon" value="icon.skill1257"/>
        <set name="skill_hit_time" value="0.5"/>
        <set name="reuse_delay" value="2.0"/>
        <set name="cast_range" value="-1"/>
        <set name="debuff" value="0"/>
    </skill>
    <skill id="54104" level="1" name="Sayha's Berserker Spirit">
        <!--TODO: Notdone-->
        <set name="operate_type" value="P"/>
        <set name="icon" value="icon.skill1062"/>
        <set name="skill_hit_time" value="0.5"/>
        <set name="reuse_delay" value="2.0"/>
        <set name="cast_range" value="-1"/>
        <set name="debuff" value="0"/>
    </skill>
    <skill id="54105" level="1" name="Sayha's Wind Walk">
        <!--TODO: Notdone-->
        <set name="operate_type" value="P"/>
        <set name="icon" value="icon.skill1204"/>
        <set name="skill_hit_time" value="0.5"/>
        <set name="reuse_delay" value="2.0"/>
        <set name="cast_range" value="-1"/>
        <set name="debuff" value="0"/>
    </skill>
    <skill id="54106" level="1" name="Sayha's Might">
        <!--TODO: Notdone-->
        <set name="operate_type" value="P"/>
        <set name="icon" value="icon.skill1068"/>
        <set name="skill_hit_time" value="0.5"/>
        <set name="reuse_delay" value="2.0"/>
        <set name="cast_range" value="-1"/>
        <set name="debuff" value="0"/>
    </skill>
    <skill id="54108" level="1" name="Sayha's Focus">
        <!--TODO: Notdone-->
        <set name="operate_type" value="P"/>
        <set name="icon" value="icon.skill1077"/>
        <set name="skill_hit_time" value="0.5"/>
        <set name="reuse_delay" value="2.0"/>
        <set name="cast_range" value="-1"/>
        <set name="debuff" value="0"/>
    </skill>
    <skill id="54109" level="1" name="Sayha's Haste">
        <!--TODO: Notdone-->
        <set name="operate_type" value="P"/>
        <set name="icon" value="icon.skill1086"/>
        <set name="skill_hit_time" value="0.5"/>
        <set name="reuse_delay" value="2.0"/>
        <set name="cast_range" value="-1"/>
        <set name="debuff" value="0"/>
    </skill>
    <skill id="54110" level="1" name="Sayha's Death Whisper">
        <!--TODO: Notdone-->
        <set name="operate_type" value="P"/>
        <set name="icon" value="icon.skill1242"/>
        <set name="skill_hit_time" value="0.5"/>
        <set name="reuse_delay" value="2.0"/>
        <set name="cast_range" value="-1"/>
        <set name="debuff" value="0"/>
    </skill>
    <skill id="54111" level="1" name="Sayha's Empower">
        <!--TODO: Notdone-->
        <set name="operate_type" value="P"/>
        <set name="icon" value="icon.skill1059"/>
        <set name="skill_hit_time" value="0.5"/>
        <set name="reuse_delay" value="2.0"/>
        <set name="cast_range" value="-1"/>
        <set name="debuff" value="0"/>
    </skill>
    <skill id="54112" level="1" name="Sayha's Clarity">
        <!--TODO: Notdone-->
        <set name="operate_type" value="P"/>
        <set name="icon" value="icon.skill1397"/>
        <set name="skill_hit_time" value="0.5"/>
        <set name="reuse_delay" value="2.0"/>
        <set name="cast_range" value="-1"/>
        <set name="debuff" value="0"/>
    </skill>
    <skill id="54113" level="1" name="Sayha's Wild Magic">
        <!--TODO: Notdone-->
        <set name="operate_type" value="P"/>
        <set name="icon" value="icon.skill1303"/>
        <set name="skill_hit_time" value="0.5"/>
        <set name="reuse_delay" value="2.0"/>
        <set name="cast_range" value="-1"/>
        <set name="debuff" value="0"/>
    </skill>
    <skill id="54114" level="1" name="Sayha's Acumen">
        <!--TODO: Notdone-->
        <set name="operate_type" value="P"/>
        <set name="icon" value="icon.skill1085"/>
        <set name="skill_hit_time" value="0.5"/>
        <set name="reuse_delay" value="2.0"/>
        <set name="cast_range" value="-1"/>
        <set name="debuff" value="0"/>
    </skill>
    <skill id="54115" level="1" name="Sayha's Concentration">
        <!--TODO: Notdone-->
        <set name="operate_type" value="P"/>
        <set name="icon" value="icon.skill1078"/>
        <set name="skill_hit_time" value="0.5"/>
        <set name="reuse_delay" value="2.0"/>
        <set name="cast_range" value="-1"/>
        <set name="debuff" value="0"/>
    </skill>
    <skill id="54116" level="1" name="Sayha's Prophecy">
        <!--TODO: Notdone-->
        <set name="operate_type" value="P"/>
        <set name="icon" value="icon.skill5074"/>
        <set name="skill_hit_time" value="0.5"/>
        <set name="reuse_delay" value="2.0"/>
        <set name="cast_range" value="-1"/>
        <set name="debuff" value="0"/>
    </skill>
    <skill id="54117" level="1" name="Sayha's Restore HP">
        <!--TODO: Notdone-->
        <set name="operate_type" value="P"/>
        <set name="icon" value="icon.skill0211"/>
        <set name="skill_hit_time" value="0.5"/>
        <set name="reuse_delay" value="2.0"/>
        <set name="cast_range" value="-1"/>
        <set name="debuff" value="0"/>
    </skill>
    <skill id="54118" level="1" name="Sayha's Restore MP">
        <!--TODO: Notdone-->
        <set name="operate_type" value="P"/>
        <set name="icon" value="icon.skill0213"/>
        <set name="skill_hit_time" value="0.5"/>
        <set name="reuse_delay" value="2.0"/>
        <set name="cast_range" value="-1"/>
        <set name="debuff" value="0"/>
    </skill>
</list>
