<?xml version="1.0" encoding="UTF-8" standalone="no"?>
<!DOCTYPE list SYSTEM "skills.dtd">
<list>
    <skill id="32663" level="1" name="Test Barrier - 5 HP and 1 Limit">
        <!--TODO: Notdone-->
        <set name="operate_type" value="P"/>
        <set name="icon" value="icon.skill11621"/>
        <set name="skill_cool_time" value="0.5"/>
        <set name="skill_hit_time" value="0.5"/>
        <set name="cast_range" value="-1"/>
        <set name="debuff" value="0"/>
    </skill>
</list>
